<!ELEMENT bookstore (book+)>
<!ELEMENT book (title, authors, price)>
<!ATTLIST book
          cathegory CDATA #REQUIRED
          cover CDATA #IMPLIED>
<!ELEMENT title (#PCDATA)>
<!ATTLIST title
          lang CDATA #REQUIRED>
<!ELEMENT authors (author+)>
<!ELEMENT author (#PCDATA)>
<!ELEMENT price (#PCDATA)>
